{
  "schemaVersion": "2.0.0",
  "target": {
    "id": "admin-support-support-finance-state-card",
    "scope": "admin",
    "symbol": "StateCard",
    "source": "apps/admin/src/features/support/components/support-finance/state-card.tsx",
    "lines": "5-42"
  },
  "sourceRevision": "6e4770d05ca67b2fecd337298359de8c6d838176",
  "direction": "NOVA admin staff surface; the existing admin navigation board tokens remain the appearance authority.",
  "purpose": "برد مستقل برای StateCard؛ متن‌ها و eventهای موجود از inventory منبع‌اند و چیدمان تصویر پیشنهادی است.",
  "sourceEvidence": {
    "labels": [],
    "jsxTags": [
      "section",
      "span",
      "Icon",
      "h2",
      "p",
      "Button"
    ],
    "stateVariables": [],
    "stateMarkers": [],
    "variants": [],
    "sizes": []
  },
  "proposal": {
    "layoutType": "card",
    "status": "PROPOSED",
    "desktop": "Independent 1440x900 component specimen inside a neutral design-review frame; geometry is not copied from the live DOM.",
    "mobile": "Independent 390x844 stacked specimen; breakpoints and behavior remain proposals unless separately defined by the owning page source.",
    "typography": {
      "display": {
        "family": "Estedad",
        "weight": 600,
        "status": "SOURCE_DEFINED",
        "assetPath": "docs/designs/components/render-source/assets/Estedad-SemiBold.ttf"
      },
      "body": {
        "family": "Vazirmatn",
        "weight": 400,
        "status": "SOURCE_DEFINED",
        "assetPath": "docs/designs/components/render-source/assets/Vazirmatn-SemiBold.ttf"
      }
    }
  },
  "actions": [
    {
      "element": "Button",
      "events": [
        "onClick"
      ],
      "label": "",
      "status": "SOURCE_DEFINED"
    }
  ],
  "states": [
    {
      "id": "baseline-specimen",
      "label": "ساختار پایه برای بررسی بصری",
      "status": "PROPOSED_BASELINE"
    }
  ],
  "sources": [
    {
      "path": "apps/admin/src/features/support/components/support-finance/state-card.tsx",
      "anchor": "StateCard (5-42)",
      "lines": "5-42",
      "sha256": "864d2645ae76a6bfda1190951e00b283edfa5bb7a404d5613cf54064e671e16e",
      "status": "INVENTORY_SOURCE_HASH_VERIFIED"
    }
  ],
  "tokens": [
    {
      "id": "page",
      "value": "#F5F1EB",
      "status": "SOURCE_DEFINED",
      "source": "docs/designs/components/admin-navigation-sidebar/design-tokens.json#tokens"
    },
    {
      "id": "surface",
      "value": "#FFFDF9",
      "status": "SOURCE_DEFINED",
      "source": "docs/designs/components/admin-navigation-sidebar/design-tokens.json#tokens"
    },
    {
      "id": "ink",
      "value": "#1A1715",
      "status": "SOURCE_DEFINED",
      "source": "docs/designs/components/admin-navigation-sidebar/design-tokens.json#tokens"
    },
    {
      "id": "charcoal",
      "value": "#1C1C1D",
      "status": "SOURCE_DEFINED",
      "source": "docs/designs/components/admin-navigation-sidebar/design-tokens.json#tokens"
    },
    {
      "id": "wine",
      "value": "#7D1F2D",
      "status": "SOURCE_DEFINED",
      "source": "docs/designs/components/admin-navigation-sidebar/design-tokens.json#tokens"
    },
    {
      "id": "wineSoft",
      "value": "#F2E4E3",
      "status": "SOURCE_DEFINED",
      "source": "docs/designs/components/admin-navigation-sidebar/design-tokens.json#tokens"
    },
    {
      "id": "line",
      "value": "#E5DED6",
      "status": "PROPOSED",
      "source": "docs/designs/components/admin-navigation-sidebar/design-tokens.json#tokens"
    }
  ],
  "assets": [
    {
      "assetId": "estedad-semibold-v8.5",
      "path": "docs/designs/components/render-source/assets/Estedad-SemiBold.ttf",
      "kind": "font",
      "license": "SIL Open Font License 1.1",
      "sha256": "a5cbf97d61e22ef5d072171db000ff8467c3992353d9124f9e0794bf35b13364"
    },
    {
      "assetId": "vazirmatn-regular-v33.003",
      "path": "docs/designs/components/render-source/assets/Vazirmatn-Regular.ttf",
      "kind": "font",
      "license": "SIL Open Font License 1.1",
      "sha256": "b69fd4c680b8f3f225feabcc655a2c585d97627b8f5f5c0f9985e894069f3a56"
    },
    {
      "assetId": "vazirmatn-semibold-v33.003",
      "path": "docs/designs/components/render-source/assets/Vazirmatn-SemiBold.ttf",
      "kind": "font",
      "license": "SIL Open Font License 1.1",
      "sha256": "3f239d8364c14ee32c46b6839fa197c28958358b82a9673d2c6acc8506d78bc5"
    }
  ],
  "frames": [
    {
      "id": "admin-support-support-finance-state-card-desktop",
      "viewportId": "desktop",
      "width": 1440,
      "height": 900,
      "screenshot": "docs/designs/components/admin-support-support-finance-state-card/02-Clean-Reference.png",
      "componentBounds": {
        "x": 106,
        "y": 258,
        "width": 1228,
        "height": 542,
        "geometryStatus": "PROPOSED",
        "captureStatus": "MEASURED_IN_RENDERER_OUTPUT"
      },
      "direction": "rtl"
    },
    {
      "id": "admin-support-support-finance-state-card-mobile",
      "viewportId": "mobile",
      "width": 390,
      "height": 844,
      "screenshot": "docs/designs/components/admin-support-support-finance-state-card/03-Clean-Reference-Mobile.png",
      "componentBounds": {
        "x": 34,
        "y": 210,
        "width": 322,
        "height": 572,
        "geometryStatus": "PROPOSED",
        "captureStatus": "MEASURED_IN_RENDERER_OUTPUT"
      },
      "direction": "rtl"
    },
    {
      "id": "admin-support-support-finance-state-card-board",
      "viewportId": "board",
      "width": 1536,
      "height": 1024,
      "screenshot": "docs/designs/components/admin-support-support-finance-state-card/01-Visual-Design-Board.png",
      "componentBounds": {
        "x": 78,
        "y": 220,
        "width": 812,
        "height": 507,
        "geometryStatus": "PROPOSED",
        "captureStatus": "MEASURED_IN_RENDERER_OUTPUT"
      },
      "direction": "rtl"
    }
  ],
  "outputs": [
    {
      "path": "docs/designs/components/admin-support-support-finance-state-card/01-Visual-Design-Board.png",
      "artifactType": "annotated-design-board",
      "status": "GENERATED"
    },
    {
      "path": "docs/designs/components/admin-support-support-finance-state-card/02-Clean-Reference.png",
      "artifactType": "clean-desktop-reference",
      "status": "GENERATED"
    },
    {
      "path": "docs/designs/components/admin-support-support-finance-state-card/03-Clean-Reference-Mobile.png",
      "artifactType": "clean-mobile-reference",
      "status": "GENERATED"
    },
    {
      "path": "docs/designs/components/admin-support-support-finance-state-card/design-spec.json",
      "artifactType": "design-specification",
      "status": "GENERATED"
    },
    {
      "path": "docs/designs/components/admin-support-support-finance-state-card/design-spec.schema.json",
      "artifactType": "json-schema",
      "status": "GENERATED"
    },
    {
      "path": "docs/designs/components/admin-support-support-finance-state-card/scene-graph.json",
      "artifactType": "scene-graph",
      "status": "GENERATED"
    },
    {
      "path": "docs/designs/components/admin-support-support-finance-state-card/source-index.json",
      "artifactType": "source-index",
      "status": "GENERATED"
    },
    {
      "path": "docs/designs/components/admin-support-support-finance-state-card/authority-map.json",
      "artifactType": "authority-map",
      "status": "GENERATED"
    },
    {
      "path": "docs/designs/components/admin-support-support-finance-state-card/conflicts.json",
      "artifactType": "conflicts-and-proposals",
      "status": "GENERATED"
    },
    {
      "path": "docs/designs/components/admin-support-support-finance-state-card/design-tokens.json",
      "artifactType": "design-tokens",
      "status": "GENERATED"
    },
    {
      "path": "docs/designs/components/admin-support-support-finance-state-card/asset-registry.json",
      "artifactType": "asset-registry",
      "status": "GENERATED"
    },
    {
      "path": "docs/designs/components/admin-support-support-finance-state-card/coverage-matrix.json",
      "artifactType": "coverage-matrix",
      "status": "GENERATED"
    },
    {
      "path": "docs/designs/components/admin-support-support-finance-state-card/qa-report.json",
      "artifactType": "qa-report",
      "status": "GENERATED"
    },
    {
      "path": "docs/designs/components/admin-support-support-finance-state-card/manifest.json",
      "artifactType": "manifest",
      "status": "GENERATED"
    },
    {
      "path": "docs/designs/components/admin-support-support-finance-state-card/component-handoff.md",
      "artifactType": "component-handoff",
      "status": "GENERATED"
    },
    {
      "path": "docs/designs/components/admin-support-support-finance-state-card/render-source/target.json",
      "artifactType": "renderer-input",
      "status": "GENERATED"
    },
    {
      "path": "docs/designs/components/admin-support-support-finance-state-card/render-source/README.md",
      "artifactType": "renderer-instructions",
      "status": "GENERATED"
    }
  ],
  "qa": {
    "status": "PASS_WITH_WARNINGS",
    "checks": [
      {
        "id": "source-identity",
        "status": "PASS",
        "method": "SHA-256 comparison against the checked component inventory",
        "evidence": "apps/admin/src/features/support/components/support-finance/state-card.tsx matches inventory hash 864d2645ae76a6bfda1190951e00b283edfa5bb7a404d5613cf54064e671e16e."
      },
      {
        "id": "artifact-dimensions",
        "status": "PASS",
        "method": "Pillow image metadata from generated PNGs",
        "evidence": "Board 1536x1024; desktop 1440x900; mobile 390x844."
      },
      {
        "id": "persian-font-and-rtl",
        "status": "PASS",
        "method": "Pillow 12.3.0 FreeType + RAQM render using bundled licensed fonts",